{
  "_meta": {
    "schema_version": "aim-curator-drift-v1.0",
    "monitor_slug": "democratic-integrity",
    "cycle_id": "wdm-2026-04-27",
    "methodology_version": "democratic-integrity-methodology-2026-Q2",
    "curator_deterministic": true,
    "curator_model": null,
    "curator_commit_sha": "f5c63ae68ecdce804e551ace3ddcf3158ee2ceb6",
    "computed_at": "2026-04-27T00:03:46+00:00",
    "input_provenance": {
      "prior_cycle_ids": [],
      "window_size": 4
    }
  },
  "triggers_fired": [
    {
      "trigger": "T4",
      "severity": "advisory",
      "evidence": {
        "carry_forward_rate": 1.0,
        "threshold": 0.8,
        "carried_over_count": 5,
        "total_count": 5
      }
    }
  ],
  "cycle_summary": {
    "structured_claims_count": 5,
    "entity_registry_size": 1,
    "carry_forward_rate": 1.0,
    "shape_fingerprint": "81cdaa9ffce136116d7e7914e74b82317cfad7f0",
    "methodology_version": "democratic-integrity-methodology-2026-Q2",
    "methodology_drift_status": {
      "uninitialised": true,
      "drift_present": null,
      "reason": "persistent-state lacks _meta.required_modules"
    }
  },
  "curator_error": false,
  "curator_flags": [
    "interpret_schema_mismatch:wdm-interpret-v1.0",
    "chains_schema_mismatch:aim-chains-v1.1"
  ]
}
