{
  "_meta": {
    "schema_version": "aim-curator-drift-v1.0",
    "monitor_slug": "conflict-escalation",
    "cycle_id": "scem-2026-04-30",
    "methodology_version": "conflict-escalation-methodology-2026-Q2",
    "curator_deterministic": true,
    "curator_model": null,
    "curator_commit_sha": "269e1a29f5293f92e920918af5e7e9647b135b93",
    "computed_at": "2026-04-30T19:45:22+00:00",
    "input_provenance": {
      "prior_cycle_ids": [],
      "window_size": 4
    }
  },
  "triggers_fired": [
    {
      "trigger": "T1",
      "severity": "advisory",
      "evidence": {
        "unsanctioned_shape_change_count": 3,
        "details": [
          {
            "cycle_index": 1,
            "shape_fingerprint_new": "ac10d5e160cb",
            "shape_fingerprint_prior": "dc3772ecb60c",
            "methodology_version": ""
          },
          {
            "cycle_index": 2,
            "shape_fingerprint_new": "dc3772ecb60c",
            "shape_fingerprint_prior": "ac10d5e160cb",
            "methodology_version": ""
          },
          {
            "cycle_index": 3,
            "shape_fingerprint_new": "ac10d5e160cb",
            "shape_fingerprint_prior": "dc3772ecb60c",
            "methodology_version": ""
          }
        ]
      }
    }
  ],
  "cycle_summary": {
    "structured_claims_count": 0,
    "entity_registry_size": 0,
    "carry_forward_rate": null,
    "shape_fingerprint": "ac10d5e160cbfe72f0f7161535ea999642335549",
    "methodology_version": "conflict-escalation-methodology-2026-Q2",
    "methodology_drift_status": {
      "uninitialised": true,
      "drift_present": null,
      "reason": "persistent-state lacks _meta.required_modules"
    }
  },
  "curator_error": false,
  "curator_flags": [
    "interpret_schema_mismatch:scem-interpret-v1.0",
    "chains_schema_mismatch:aim-chains-v1.1"
  ]
}
