{
  "_meta": {
    "schema_version": "aim-curator-drift-v1.0",
    "monitor_slug": "ai-governance",
    "cycle_id": "agm-2026-04-26",
    "methodology_version": "agm-methodology-2026-Q2",
    "curator_deterministic": true,
    "curator_model": null,
    "curator_commit_sha": "90fb5de8d7f96de22f965a4cb79e025ec1072310",
    "computed_at": "2026-04-26T09:26:24+00:00",
    "input_provenance": {
      "prior_cycle_ids": [],
      "window_size": 4
    }
  },
  "triggers_fired": [
    {
      "trigger": "T1",
      "severity": "advisory",
      "evidence": {
        "unsanctioned_shape_change_count": 3,
        "details": [
          {
            "cycle_index": 1,
            "shape_fingerprint_new": "141fdc125c19",
            "shape_fingerprint_prior": "fd4f4abc3c73",
            "methodology_version": ""
          },
          {
            "cycle_index": 2,
            "shape_fingerprint_new": "fd4f4abc3c73",
            "shape_fingerprint_prior": "141fdc125c19",
            "methodology_version": ""
          },
          {
            "cycle_index": 3,
            "shape_fingerprint_new": "141fdc125c19",
            "shape_fingerprint_prior": "fd4f4abc3c73",
            "methodology_version": ""
          }
        ]
      }
    }
  ],
  "cycle_summary": {
    "structured_claims_count": 0,
    "entity_registry_size": 0,
    "carry_forward_rate": null,
    "shape_fingerprint": "141fdc125c19433b225d1cf8eb064e4196c60ae4",
    "methodology_version": "agm-methodology-2026-Q2",
    "methodology_drift_status": {
      "uninitialised": false,
      "methodology_version_active": "agm-methodology-2026-Q2",
      "methodology_version_declared_in_state": "agm-methodology-2026-Q2",
      "version_match": true,
      "required_modules_declared": 11,
      "required_modules_present": 11,
      "missing_modules": [],
      "drift_present": false
    }
  },
  "curator_error": false,
  "curator_flags": [
    "chains_schema_mismatch:aim-chains-v1.1"
  ]
}
