{
  "_meta": {
    "schema_version": "aim-curator-drift-v1.0",
    "monitor_slug": "european-strategic-autonomy",
    "cycle_id": "esa-2026-04-27",
    "methodology_version": "european-strategic-autonomy-methodology-2026-Q2",
    "curator_deterministic": true,
    "curator_model": null,
    "curator_commit_sha": "dca4d7e1cf3e085f3ce7f61e56e6745395e9bc01",
    "computed_at": "2026-04-27T09:34:17+00:00",
    "input_provenance": {
      "prior_cycle_ids": [],
      "window_size": 4
    }
  },
  "triggers_fired": [],
  "cycle_summary": {
    "structured_claims_count": 20,
    "entity_registry_size": 14,
    "carry_forward_rate": null,
    "shape_fingerprint": "9cf00a7e0617c12b7c102a9c2ca6a077b163fc5f",
    "methodology_version": "european-strategic-autonomy-methodology-2026-Q2",
    "methodology_drift_status": {
      "uninitialised": true,
      "drift_present": null,
      "reason": "persistent-state lacks _meta.required_modules"
    }
  },
  "curator_error": false,
  "curator_flags": [
    "interpret_schema_mismatch:esa-interpret-v1.0",
    "chains_schema_mismatch:aim-chains-v1.1"
  ]
}
