{
  "_meta": {
    "schema_version": "aim-curator-drift-v1.0",
    "monitor_slug": "financial-integrity",
    "cycle_id": "fim-2026-05-04",
    "methodology_version": "fim-methodology-v1.1",
    "curator_deterministic": true,
    "curator_model": null,
    "curator_commit_sha": "fd3255e6393d332cfb46049adccda708b1284045",
    "computed_at": "2026-05-04T08:19:08+00:00",
    "input_provenance": {
      "prior_cycle_ids": [],
      "window_size": 4
    }
  },
  "triggers_fired": [
    {
      "trigger": "T1",
      "severity": "advisory",
      "evidence": {
        "unsanctioned_shape_change_count": 3,
        "details": [
          {
            "cycle_index": 1,
            "shape_fingerprint_new": "a2b46e356a38",
            "shape_fingerprint_prior": "dc5e0aa8a49f",
            "methodology_version": ""
          },
          {
            "cycle_index": 2,
            "shape_fingerprint_new": "dc5e0aa8a49f",
            "shape_fingerprint_prior": "dc3772ecb60c",
            "methodology_version": ""
          },
          {
            "cycle_index": 3,
            "shape_fingerprint_new": "dc3772ecb60c",
            "shape_fingerprint_prior": "a2b46e356a38",
            "methodology_version": ""
          }
        ]
      }
    },
    {
      "trigger": "T3",
      "severity": "advisory",
      "evidence": {
        "dropped_entity": "China",
        "candidate_chain_scan_empty": true
      },
      "flags": [
        "awaiting_appendix_a_patches"
      ]
    },
    {
      "trigger": "T3",
      "severity": "advisory",
      "evidence": {
        "dropped_entity": "Czech Republic",
        "candidate_chain_scan_empty": true
      },
      "flags": [
        "awaiting_appendix_a_patches"
      ]
    },
    {
      "trigger": "T3",
      "severity": "advisory",
      "evidence": {
        "dropped_entity": "DeFi protocols",
        "candidate_chain_scan_empty": true
      },
      "flags": [
        "awaiting_appendix_a_patches"
      ]
    },
    {
      "trigger": "T3",
      "severity": "advisory",
      "evidence": {
        "dropped_entity": "Democratic Republic of Congo",
        "candidate_chain_scan_empty": true
      },
      "flags": [
        "awaiting_appendix_a_patches"
      ]
    },
    {
      "trigger": "T3",
      "severity": "advisory",
      "evidence": {
        "dropped_entity": "EU",
        "candidate_chain_scan_empty": true
      },
      "flags": [
        "awaiting_appendix_a_patches"
      ]
    },
    {
      "trigger": "T3",
      "severity": "advisory",
      "evidence": {
        "dropped_entity": "European Union",
        "candidate_chain_scan_empty": true
      },
      "flags": [
        "awaiting_appendix_a_patches"
      ]
    },
    {
      "trigger": "T3",
      "severity": "advisory",
      "evidence": {
        "dropped_entity": "Global",
        "candidate_chain_scan_empty": true
      },
      "flags": [
        "awaiting_appendix_a_patches"
      ]
    },
    {
      "trigger": "T3",
      "severity": "advisory",
      "evidence": {
        "dropped_entity": "Global jurisdictions",
        "candidate_chain_scan_empty": true
      },
      "flags": [
        "awaiting_appendix_a_patches"
      ]
    },
    {
      "trigger": "T3",
      "severity": "advisory",
      "evidence": {
        "dropped_entity": "Global offshore jurisdictions",
        "candidate_chain_scan_empty": true
      },
      "flags": [
        "awaiting_appendix_a_patches"
      ]
    },
    {
      "trigger": "T3",
      "severity": "advisory",
      "evidence": {
        "dropped_entity": "Investment Advisers",
        "candidate_chain_scan_empty": true
      },
      "flags": [
        "awaiting_appendix_a_patches"
      ]
    },
    {
      "trigger": "T3",
      "severity": "advisory",
      "evidence": {
        "dropped_entity": "Libyan Investment Authority",
        "candidate_chain_scan_empty": true
      },
      "flags": [
        "awaiting_appendix_a_patches"
      ]
    },
    {
      "trigger": "T3",
      "severity": "advisory",
      "evidence": {
        "dropped_entity": "Russia",
        "candidate_chain_scan_empty": true
      },
      "flags": [
        "awaiting_appendix_a_patches"
      ]
    },
    {
      "trigger": "T3",
      "severity": "advisory",
      "evidence": {
        "dropped_entity": "Russian shadow fleet",
        "candidate_chain_scan_empty": true
      },
      "flags": [
        "awaiting_appendix_a_patches"
      ]
    },
    {
      "trigger": "T3",
      "severity": "advisory",
      "evidence": {
        "dropped_entity": "Sahel Region",
        "candidate_chain_scan_empty": true
      },
      "flags": [
        "awaiting_appendix_a_patches"
      ]
    },
    {
      "trigger": "T3",
      "severity": "advisory",
      "evidence": {
        "dropped_entity": "Singapore",
        "candidate_chain_scan_empty": true
      },
      "flags": [
        "awaiting_appendix_a_patches"
      ]
    },
    {
      "trigger": "T3",
      "severity": "advisory",
      "evidence": {
        "dropped_entity": "South Africa",
        "candidate_chain_scan_empty": true
      },
      "flags": [
        "awaiting_appendix_a_patches"
      ]
    },
    {
      "trigger": "T3",
      "severity": "advisory",
      "evidence": {
        "dropped_entity": "Switzerland",
        "candidate_chain_scan_empty": true
      },
      "flags": [
        "awaiting_appendix_a_patches"
      ]
    },
    {
      "trigger": "T3",
      "severity": "advisory",
      "evidence": {
        "dropped_entity": "United Arab Emirates",
        "candidate_chain_scan_empty": true
      },
      "flags": [
        "awaiting_appendix_a_patches"
      ]
    },
    {
      "trigger": "T3",
      "severity": "advisory",
      "evidence": {
        "dropped_entity": "United States",
        "candidate_chain_scan_empty": true
      },
      "flags": [
        "awaiting_appendix_a_patches"
      ]
    },
    {
      "trigger": "T3",
      "severity": "advisory",
      "evidence": {
        "dropped_entity": "World Bank",
        "candidate_chain_scan_empty": true
      },
      "flags": [
        "awaiting_appendix_a_patches"
      ]
    },
    {
      "trigger": "T4",
      "severity": "advisory",
      "evidence": {
        "carry_forward_rate": 1.0,
        "threshold": 0.8,
        "carried_over_count": 12,
        "total_count": 12
      }
    }
  ],
  "cycle_summary": {
    "structured_claims_count": 12,
    "entity_registry_size": 11,
    "carry_forward_rate": 1.0,
    "shape_fingerprint": "a2b46e356a38c9dea18c134eda4f7928c75d272e",
    "methodology_version": "fim-methodology-v1.1",
    "methodology_drift_status": {
      "uninitialised": true,
      "drift_present": null,
      "reason": "persistent-state lacks _meta.required_modules"
    }
  },
  "curator_error": false,
  "curator_flags": [
    "interpret_schema_mismatch:fim-interpret-v1.0",
    "chains_schema_mismatch:aim-chains-v1.1"
  ],
  "schema_canonicalizations": []
}
