{
  "_meta": {
    "schema_version": "aim-curator-drift-v1.0",
    "monitor_slug": "macro-monitor",
    "cycle_id": "gmm-2026-05-05",
    "methodology_version": "macro-monitor-methodology-2026-Q2",
    "curator_deterministic": true,
    "curator_model": null,
    "curator_commit_sha": "6aa499ffae21ee14ac424085cf09fa2bb29b0ac4",
    "computed_at": "2026-05-05T00:03:22+00:00",
    "input_provenance": {
      "prior_cycle_ids": [],
      "window_size": 4
    }
  },
  "triggers_fired": [
    {
      "trigger": "T1",
      "severity": "advisory",
      "evidence": {
        "unsanctioned_shape_change_count": 3,
        "details": [
          {
            "cycle_index": 1,
            "shape_fingerprint_new": "a0397d3c7143",
            "shape_fingerprint_prior": "22213f16612f",
            "methodology_version": ""
          },
          {
            "cycle_index": 2,
            "shape_fingerprint_new": "22213f16612f",
            "shape_fingerprint_prior": "37fd83c34a6f",
            "methodology_version": ""
          },
          {
            "cycle_index": 3,
            "shape_fingerprint_new": "37fd83c34a6f",
            "shape_fingerprint_prior": "51896cda8df5",
            "methodology_version": ""
          }
        ]
      }
    },
    {
      "trigger": "T3",
      "severity": "advisory",
      "evidence": {
        "dropped_entity": "BIS",
        "candidate_chain_scan_empty": true
      },
      "flags": [
        "awaiting_appendix_a_patches"
      ]
    },
    {
      "trigger": "T3",
      "severity": "advisory",
      "evidence": {
        "dropped_entity": "EU",
        "candidate_chain_scan_empty": true
      },
      "flags": [
        "awaiting_appendix_a_patches"
      ]
    },
    {
      "trigger": "T3",
      "severity": "advisory",
      "evidence": {
        "dropped_entity": "EU-US",
        "candidate_chain_scan_empty": true
      },
      "flags": [
        "awaiting_appendix_a_patches"
      ]
    },
    {
      "trigger": "T3",
      "severity": "advisory",
      "evidence": {
        "dropped_entity": "G-7",
        "candidate_chain_scan_empty": true
      },
      "flags": [
        "awaiting_appendix_a_patches"
      ]
    },
    {
      "trigger": "T4",
      "severity": "advisory",
      "evidence": {
        "carry_forward_rate": 1.0,
        "threshold": 0.8,
        "carried_over_count": 24,
        "total_count": 24
      }
    }
  ],
  "cycle_summary": {
    "structured_claims_count": 24,
    "entity_registry_size": 22,
    "carry_forward_rate": 1.0,
    "shape_fingerprint": "a0397d3c71439b733bab899f9269caba1c2ee866",
    "methodology_version": "macro-monitor-methodology-2026-Q2",
    "methodology_drift_status": {
      "uninitialised": true,
      "drift_present": null,
      "reason": "persistent-state lacks _meta.required_modules"
    }
  },
  "curator_error": false,
  "curator_flags": [
    "interpret_schema_mismatch:gmm-interpret-v1.0",
    "chains_schema_mismatch:aim-chains-v1.1"
  ],
  "schema_canonicalizations": []
}
