{
  "_meta": {
    "schema_version": "aim-curator-drift-v1.0",
    "monitor_slug": "conflict-escalation",
    "cycle_id": "scem-2026-05-10",
    "methodology_version": "conflict-escalation-methodology-2026-Q2",
    "curator_deterministic": true,
    "curator_model": null,
    "curator_commit_sha": "19e0247c972e0dc5605efd1cd9a826c990e41e38",
    "computed_at": "2026-05-13T17:12:12+00:00",
    "input_provenance": {
      "prior_cycle_ids": [],
      "window_size": 4
    }
  },
  "triggers_fired": [
    {
      "trigger": "T1",
      "severity": "advisory",
      "evidence": {
        "unsanctioned_shape_change_count": 3,
        "details": [
          {
            "cycle_index": 1,
            "shape_fingerprint_new": "9edd83060bbc",
            "shape_fingerprint_prior": "97288188d1f7",
            "methodology_version": ""
          },
          {
            "cycle_index": 2,
            "shape_fingerprint_new": "97288188d1f7",
            "shape_fingerprint_prior": "17d085bb7f2c",
            "methodology_version": ""
          },
          {
            "cycle_index": 3,
            "shape_fingerprint_new": "17d085bb7f2c",
            "shape_fingerprint_prior": "2126415e2690",
            "methodology_version": ""
          }
        ]
      }
    },
    {
      "trigger": "T3",
      "severity": "advisory",
      "evidence": {
        "dropped_entity": "Al-Qaeda in the Arabian Peninsula (AQAP)",
        "candidate_chain_scan_empty": true
      },
      "flags": [
        "awaiting_appendix_a_patches"
      ]
    },
    {
      "trigger": "T3",
      "severity": "advisory",
      "evidence": {
        "dropped_entity": "DRC Switzerland talks",
        "candidate_chain_scan_empty": true
      },
      "flags": [
        "awaiting_appendix_a_patches"
      ]
    },
    {
      "trigger": "T3",
      "severity": "advisory",
      "evidence": {
        "dropped_entity": "Democratic People's Republic of Korea (DPRK)",
        "candidate_chain_scan_empty": true
      },
      "flags": [
        "awaiting_appendix_a_patches"
      ]
    },
    {
      "trigger": "T3",
      "severity": "advisory",
      "evidence": {
        "dropped_entity": "Gaza / Israel-Hamas ceasefire",
        "candidate_chain_scan_empty": true
      },
      "flags": [
        "awaiting_appendix_a_patches"
      ]
    },
    {
      "trigger": "T3",
      "severity": "advisory",
      "evidence": {
        "dropped_entity": "Iran nuclear talks",
        "candidate_chain_scan_empty": true
      },
      "flags": [
        "awaiting_appendix_a_patches"
      ]
    },
    {
      "trigger": "T3",
      "severity": "advisory",
      "evidence": {
        "dropped_entity": "Israel-Lebanon / Hezbollah ceasefire",
        "candidate_chain_scan_empty": true
      },
      "flags": [
        "awaiting_appendix_a_patches"
      ]
    },
    {
      "trigger": "T3",
      "severity": "advisory",
      "evidence": {
        "dropped_entity": "Rapid Support Forces (RSF) and Sudan People's Liberation Movement-North (SPLM-N)",
        "candidate_chain_scan_empty": true
      },
      "flags": [
        "awaiting_appendix_a_patches"
      ]
    },
    {
      "trigger": "T3",
      "severity": "advisory",
      "evidence": {
        "dropped_entity": "Russia-Ukraine Easter ceasefire",
        "candidate_chain_scan_empty": true
      },
      "flags": [
        "awaiting_appendix_a_patches"
      ]
    },
    {
      "trigger": "T3",
      "severity": "advisory",
      "evidence": {
        "dropped_entity": "Russian Federation",
        "candidate_chain_scan_empty": true
      },
      "flags": [
        "awaiting_appendix_a_patches"
      ]
    },
    {
      "trigger": "T3",
      "severity": "advisory",
      "evidence": {
        "dropped_entity": "Spring Coalition of Ethnic Forces (SCEF)",
        "candidate_chain_scan_empty": true
      },
      "flags": [
        "awaiting_appendix_a_patches"
      ]
    },
    {
      "trigger": "T3",
      "severity": "advisory",
      "evidence": {
        "dropped_entity": "Sudan Civil War",
        "candidate_chain_scan_empty": true
      },
      "flags": [
        "awaiting_appendix_a_patches"
      ]
    },
    {
      "trigger": "T3",
      "severity": "advisory",
      "evidence": {
        "dropped_entity": "Sudan Quad mediation",
        "candidate_chain_scan_empty": true
      },
      "flags": [
        "awaiting_appendix_a_patches"
      ]
    },
    {
      "trigger": "T3",
      "severity": "advisory",
      "evidence": {
        "dropped_entity": "Sudanese Armed Forces (SAF)",
        "candidate_chain_scan_empty": true
      },
      "flags": [
        "awaiting_appendix_a_patches"
      ]
    },
    {
      "trigger": "T3",
      "severity": "advisory",
      "evidence": {
        "dropped_entity": "United States",
        "candidate_chain_scan_empty": true
      },
      "flags": [
        "awaiting_appendix_a_patches"
      ]
    },
    {
      "trigger": "T4",
      "severity": "advisory",
      "evidence": {
        "carry_forward_rate": 1.0,
        "threshold": 0.8,
        "carried_over_count": 20,
        "total_count": 20
      }
    }
  ],
  "cycle_summary": {
    "structured_claims_count": 20,
    "entity_registry_size": 16,
    "carry_forward_rate": 1.0,
    "shape_fingerprint": "9edd83060bbc3445693ffdd0b266a8c3c43d9764",
    "methodology_version": "conflict-escalation-methodology-2026-Q2",
    "methodology_drift_status": {
      "uninitialised": true,
      "drift_present": null,
      "reason": "persistent-state lacks _meta.required_modules"
    }
  },
  "curator_error": false,
  "curator_flags": [],
  "schema_canonicalizations": [
    "interpret:scem-interpret-v1.0->aim-interpret-v1.0"
  ]
}
